{"$schema":"https://json-schema.org/draft/2020-12/schema","$id":"https://ilka.local/schemas/today-view.schema.json","title":"TodayView","type":"object","additionalProperties":false,"required":["expedition_id","participant_id","local_date","day","stage","sync_status","cards","tasks","outputs","expedition_status","expedition_completion"],"properties":{"expedition_id":{"type":"string"},"participant_id":{"type":"string"},"local_date":{"type":"string","format":"date"},"day":{"type":"object","required":["number","status"],"properties":{"number":{"type":"integer","minimum":1},"status":{"enum":["not_started","active","review","closed","transition_failed"]},"boundary_sync_state":{"enum":["authoritative","expired_pending_sync","awaiting_bundle_sync"]}},"additionalProperties":false},"stage":{"type":"object","required":["stage_id","title"],"properties":{"stage_id":{"type":"string"},"title":{"type":"string"},"status":{"enum":["locked","available","active","completed"]},"next_stage_id":{"type":["string","null"]},"advance_request_status":{"enum":["none","pending","synced","conflict","rejected"]},"pending_target_stage_id":{"type":["string","null"]}},"additionalProperties":false},"product_role":{"type":["object","null"],"properties":{"assignment_id":{"type":"string"},"role_id":{"type":"string"},"title":{"type":"string"},"state":{"enum":["scheduled","active","expired","overridden","expired_pending_sync"]}},"additionalProperties":false},"onboard_role":{"type":["object","null"],"properties":{"assignment_id":{"type":"string"},"role_id":{"type":"string"},"title":{"type":"string"},"state":{"enum":["scheduled","active","expired","overridden","expired_pending_sync"]}},"additionalProperties":false},"cards":{"type":"array","items":{"type":"object","required":["card_id","title","required","acknowledged"],"properties":{"card_id":{"type":"string"},"title":{"type":"string"},"required":{"type":"boolean"},"acknowledged":{"type":"boolean"},"pending_sync":{"type":"boolean"}},"additionalProperties":false}},"tasks":{"type":"array","items":{"type":"object","required":["task_id","title","status"],"properties":{"task_id":{"type":"string"},"title":{"type":"string"},"status":{"enum":["available","in_progress","blocked","completed","overdue","completed_late","waived"]},"due_day_number":{"type":"integer"},"pending_sync":{"type":"boolean"}},"additionalProperties":false}},"sync_status":{"enum":["synced","pending","conflict","rejected","offline"]},"outputs":{"type":"array","items":{"type":"object","additionalProperties":false,"required":["output_id","title","required","confirmed"],"properties":{"output_id":{"type":"string"},"title":{"type":"string"},"required":{"type":"boolean"},"confirmed":{"type":"boolean"},"pending_sync":{"type":"boolean"}}}},"decision_vote":{"type":["object","null"],"additionalProperties":false,"required":["status","eligible"],"properties":{"status":{"enum":["none","pending_sync","open","closed","finalized","overridden"]},"eligible":{"type":"boolean"},"vote_id":{"type":["string","null"]},"decision_id":{"type":["string","null"]},"round_version":{"type":["integer","null"],"minimum":1},"options":{"type":"array","items":{"type":"object","required":["option_id","title"],"properties":{"option_id":{"type":"string"},"title":{"type":"string"}},"additionalProperties":false}},"my_choice":{"type":["string","null"]},"my_ballot_revision":{"type":["integer","null"],"minimum":1},"pending_sync":{"type":"boolean"}}},"gamification":{"type":["object","null"],"additionalProperties":false,"required":["rules_version","xp_state","role_mastery","contribution"],"properties":{"rules_version":{"type":"integer","minimum":1},"xp_state":{"enum":["provisional","synced","conflict","rejected"]},"role_mastery":{"type":"array","items":{"type":"object","additionalProperties":false,"required":["role_id","xp","level"],"properties":{"role_id":{"type":"string","pattern":"^[a-z0-9_]+$"},"xp":{"type":"integer","minimum":0},"level":{"enum":["observer","crew","practiced","lead","mentor"]},"next_level_xp":{"type":["integer","null"],"minimum":0}}}},"contribution":{"type":"object","additionalProperties":false,"required":["score","rank","status","snapshot_at"],"properties":{"score":{"type":"number","minimum":0,"maximum":100},"rank":{"type":["integer","null"],"minimum":1},"status":{"enum":["active","inactive","not_enough_data"]},"snapshot_at":{"type":"string","format":"date-time"}}}}},"expedition_status":{"enum":["draft","ready","active","suspended","completed","cancelled"]},"expedition_completion":{"type":["object","null"],"additionalProperties":false,"required":["completed_at","final_stage_id","final_day_number","shore_package_ref","completion_summary","final_projection_version"],"properties":{"completed_at":{"type":"string","format":"date-time"},"final_stage_id":{"const":"demo_day"},"final_day_number":{"const":12},"shore_package_ref":{"type":"string","minLength":1},"completion_summary":{"type":"string","minLength":1},"final_projection_version":{"type":"integer","minimum":1}}}},"allOf":[{"$comment":"expedition completion projection invariant","if":{"properties":{"expedition_status":{"const":"completed"}},"required":["expedition_status"]},"then":{"properties":{"expedition_completion":{"type":"object"}}},"else":{"properties":{"expedition_completion":{"type":"null"}}}}]}